{
  "id": "agent-question",
  "title": "An AI asks a question",
  "sections": [
    {
      "id": "one-sentence",
      "title": "One sentence",
      "body": "Follow one change from its origin to its evidence and outcome."
    },
    {
      "id": "plain-language",
      "title": "In plain language",
      "body": "Read the steps in order. Each stage has a different responsibility; arrows do not mean every stage runs automatically."
    },
    {
      "id": "example",
      "title": "Concrete example",
      "body": "Teaching scenario: an authorized Drive document contains “Joule Studio is an environment for developing AI agents at SAP.” The sentence is illustrative source text, not a fact verified by this site."
    },
    {
      "id": "in-knowledge-os",
      "title": "In this Knowledge OS",
      "body": "Follow the diagram below and open a stage to inspect its architecture."
    },
    {
      "id": "why",
      "title": "Why it exists",
      "body": "Preserving identity, history and authorization makes later explanations traceable."
    },
    {
      "id": "related",
      "title": "Related concepts",
      "body": "Learn these connected concepts next."
    },
    {
      "id": "technical",
      "title": "Technical detail",
      "body": "This is a guided explanation of the checked snapshot, not an executed integration test. Open findings and deferred providers still apply."
    },
    {
      "id": "implementation",
      "title": "Implementation",
      "body": "Open the checked implementation, tests, contracts and migrations below. These links identify evidence, not new verification."
    }
  ],
  "steps": [
    {
      "id": "query",
      "nodeId": "mcp",
      "title": "Receive a question",
      "body": "The host fixes identity and workspace before tools run."
    },
    {
      "id": "find",
      "nodeId": "keyword",
      "title": "Retrieve candidates",
      "body": "Keyword or hybrid retrieval finds permitted evidence; graph reads offer another path."
    },
    {
      "id": "evidence",
      "nodeId": "contract-evidence",
      "title": "Return exact evidence",
      "body": "Evidence identifies chunks, versions and source provenance."
    },
    {
      "id": "answer",
      "nodeId": "api",
      "title": "Consumer forms an answer",
      "body": "A separate model or human uses the evidence. Retrieval alone does not guarantee correct wording."
    }
  ],
  "reviewedPeerDigest": "257f0aa3aad6e96769f0cdd8a93d01652c30d62b94b922350e17614a60db88dd"
}
