{
  "id": "connectors",
  "title": "연결기 (Connectors)",
  "sections": [
    {
      "id": "one-sentence",
      "title": "한 줄 설명",
      "body": "원본에서 관찰한 내용을 수집 계약으로 변환하는 어댑터입니다."
    },
    {
      "id": "plain-language",
      "title": "쉽게 설명하면",
      "body": "원본에서 관찰한 내용을 수집 계약으로 변환하는 어댑터입니다. 전체 문서 여정의 한 부분으로 이해하면 됩니다."
    },
    {
      "id": "example",
      "title": "실제 예시",
      "body": "Drive, Notion, 파일이 같은 manifest 경계를 사용합니다."
    },
    {
      "id": "in-knowledge-os",
      "title": "Knowledge OS에서는",
      "body": "제공자 스냅샷을 manifest-v2의 추가·갱신과 삭제 관찰로 변환합니다. 제공자 권한의 한계도 명시합니다."
    },
    {
      "id": "why",
      "title": "왜 필요한가",
      "body": "제공자 SDK가 지식 모델을 다시 정의하지 않도록 합니다."
    },
    {
      "id": "related",
      "title": "다른 개념과의 관계",
      "body": "다음 개념을 함께 읽으면 이해가 이어집니다."
    },
    {
      "id": "technical",
      "title": "기술적으로는",
      "body": "아래의 정확한 저장소 참조를 따라 확인할 수 있습니다. 참조가 존재한다고 새로운 실행 검증 결과가 되는 것은 아닙니다."
    },
    {
      "id": "implementation",
      "title": "실제 구현 위치",
      "body": "아래에서 확인된 구현·테스트·계약·마이그레이션을 열 수 있습니다. 링크는 근거 위치를 가리키며 새로운 검증을 뜻하지 않습니다."
    }
  ],
  "steps": [],
  "reviewedPeerDigest": "e6f7a2e299cba3f0c52b12636b53f9dd8eb004c659a8a7900ea2c43a644fdd97"
}
