{
  "id": "event",
  "title": "사건 (Event)",
  "sections": [
    {
      "id": "one-sentence",
      "title": "한 줄 설명",
      "body": "일어난 일을 나타내는 기록입니다."
    },
    {
      "id": "plain-language",
      "title": "쉽게 설명하면",
      "body": "일어난 일을 나타내는 기록입니다. 전체 문서 여정의 한 부분으로 이해하면 됩니다."
    },
    {
      "id": "example",
      "title": "실제 예시",
      "body": "업무 출시는 의미 사건이고 원본 삭제 관찰은 운영 사건입니다."
    },
    {
      "id": "in-knowledge-os",
      "title": "Knowledge OS에서는",
      "body": "의미 Event는 제안·승인을 거쳐 근거를 보존합니다. 운영 사건은 별도 분류와 계보를 갖습니다."
    },
    {
      "id": "why",
      "title": "왜 필요한가",
      "body": "업무 사건과 동기화 사건을 섞으면 의미가 불분명해집니다."
    },
    {
      "id": "related",
      "title": "다른 개념과의 관계",
      "body": "다음 개념을 함께 읽으면 이해가 이어집니다."
    },
    {
      "id": "technical",
      "title": "기술적으로는",
      "body": "아래의 정확한 저장소 참조를 따라 확인할 수 있습니다. 참조가 존재한다고 새로운 실행 검증 결과가 되는 것은 아닙니다."
    },
    {
      "id": "implementation",
      "title": "실제 구현 위치",
      "body": "아래에서 확인된 구현·테스트·계약·마이그레이션을 열 수 있습니다. 링크는 근거 위치를 가리키며 새로운 검증을 뜻하지 않습니다."
    }
  ],
  "steps": [],
  "reviewedPeerDigest": "15a2d605fb8ab29f181eeb371dad6f6f14ab3c65ddc6981c2786e13889419f62"
}
