{
  "id": "relationship",
  "title": "관계 (Relationship)",
  "sections": [
    {
      "id": "one-sentence",
      "title": "한 줄 설명",
      "body": "두 대상이 어떻게 연결되는지 이름을 붙여 표현한 것입니다."
    },
    {
      "id": "plain-language",
      "title": "쉽게 설명하면",
      "body": "두 도구 사이에 선만 긋는 것보다 “사용한다”라고 적으면 연결의 의미가 분명해집니다."
    },
    {
      "id": "example",
      "title": "실제 예시",
      "body": "Technology USES Technology라는 예시 진술도 등록된 양 끝 유형 규칙을 따라야 합니다."
    },
    {
      "id": "in-knowledge-os",
      "title": "Knowledge OS에서는",
      "body": "의미 관계는 온톨로지에 속합니다. 근거 연결처럼 계보를 나타내는 선은 구조적인 역할이 다릅니다."
    },
    {
      "id": "why",
      "title": "왜 필요한가",
      "body": "관계 이름이 있어야 그래프를 따라가며 의미를 이해할 수 있습니다."
    },
    {
      "id": "related",
      "title": "다른 개념과의 관계",
      "body": "다음 개념을 함께 읽으면 이해가 이어집니다."
    },
    {
      "id": "technical",
      "title": "기술적으로는",
      "body": "진술은 관계 이름뿐 아니라 근거와 시간을 보존합니다. 엔터티 사이의 단순한 선으로 이를 대체할 수 없습니다."
    },
    {
      "id": "implementation",
      "title": "실제 구현 위치",
      "body": "아래에서 확인된 구현·테스트·계약·마이그레이션을 열 수 있습니다. 링크는 근거 위치를 가리키며 새로운 검증을 뜻하지 않습니다."
    }
  ],
  "steps": [],
  "reviewedPeerDigest": "308cf6406693603be8b1916a41d21c80a79b28f8ad3438a2986fe6abfac88895"
}
