{
  "id": "storage-boundaries",
  "title": "왜 모든 것을 Neo4j에 넣지 않나요?",
  "sections": [
    {
      "id": "one-sentence",
      "title": "한 줄 설명",
      "body": "ADR은 의미 맥락을 Neo4j에, 로컬 운영 기록을 SQLite에 배치합니다. 이는 책임의 경계이며 Neo4j가 로그를 저장할 수 없다는 주장이 아닙니다."
    },
    {
      "id": "plain-language",
      "title": "쉽게 설명하면",
      "body": "기술을 고르기 전에 책임과 근거부터 살펴보세요."
    },
    {
      "id": "example",
      "title": "실제 예시",
      "body": "연결된 문서 여정에서 이 경계가 어떻게 작동하는지 확인하세요."
    },
    {
      "id": "in-knowledge-os",
      "title": "Knowledge OS에서는",
      "body": "ADR은 의미 맥락을 Neo4j에, 로컬 운영 기록을 SQLite에 배치합니다. 이는 책임의 경계이며 Neo4j가 로그를 저장할 수 없다는 주장이 아닙니다."
    },
    {
      "id": "why",
      "title": "왜 필요한가",
      "body": "안정된 경계는 계보를 보호하고 불필요한 인프라를 줄입니다."
    },
    {
      "id": "related",
      "title": "다른 개념과의 관계",
      "body": "다음 개념을 함께 읽으면 이해가 이어집니다."
    },
    {
      "id": "technical",
      "title": "기술적으로는",
      "body": "승인된 ADR이 기준입니다. ADR에 추가 이유가 없다면 이 페이지도 더 나아간 주장을 하지 않습니다."
    },
    {
      "id": "implementation",
      "title": "실제 구현 위치",
      "body": "아래에서 확인된 구현·테스트·계약·마이그레이션을 열 수 있습니다. 링크는 근거 위치를 가리키며 새로운 검증을 뜻하지 않습니다."
    }
  ],
  "steps": [],
  "reviewedPeerDigest": "cba4e1c1bd6726206f38dedb6881f2578b6a69785dbc9a94a147f3b3b4a43857"
}
