{
  "id": "valid-from",
  "title": "유효 시작 (valid_from)",
  "sections": [
    {
      "id": "one-sentence",
      "title": "한 줄 설명",
      "body": "진술의 적용이 시작되는 시점입니다."
    },
    {
      "id": "plain-language",
      "title": "쉽게 설명하면",
      "body": "유효성, 관찰, 기록을 각각 다른 시계에 대한 질문으로 구분하세요."
    },
    {
      "id": "example",
      "title": "실제 예시",
      "body": "정책이 1월 1일부터 적용됩니다."
    },
    {
      "id": "in-knowledge-os",
      "title": "Knowledge OS에서는",
      "body": "시간 메타데이터는 문서 순서에서 추측하지 않고 승인된 기록과 함께 보존합니다."
    },
    {
      "id": "why",
      "title": "왜 필요한가",
      "body": "여러 시각을 구별해야 과거에 대한 오해를 막을 수 있습니다."
    },
    {
      "id": "related",
      "title": "다른 개념과의 관계",
      "body": "다음 개념을 함께 읽으면 이해가 이어집니다."
    },
    {
      "id": "technical",
      "title": "기술적으로는",
      "body": "시점 조회의 유효 구간 검사에서 시작 경계는 포함됩니다."
    },
    {
      "id": "implementation",
      "title": "실제 구현 위치",
      "body": "아래에서 확인된 구현·테스트·계약·마이그레이션을 열 수 있습니다. 링크는 근거 위치를 가리키며 새로운 검증을 뜻하지 않습니다."
    }
  ],
  "steps": [],
  "reviewedPeerDigest": "c1c8d3bd7f265247bc310127cfa2b0bab051b5d65ab329b5761dd03d0abdbb1b"
}
