{
  "id": "stable-contracts",
  "title": "Stable contracts and the North Star",
  "sections": [
    {
      "id": "one-sentence",
      "title": "One sentence",
      "body": "Source, Evidence, Knowledge, Governance, Retrieval and Action remain stable boundaries. Change foundations only with measured correctness, quality, performance, security or source-contract evidence."
    },
    {
      "id": "plain-language",
      "title": "In plain language",
      "body": "Start with responsibility and evidence before choosing technology."
    },
    {
      "id": "example",
      "title": "Concrete example",
      "body": "Follow the linked document journey to see this boundary in practice."
    },
    {
      "id": "in-knowledge-os",
      "title": "In this Knowledge OS",
      "body": "Source, Evidence, Knowledge, Governance, Retrieval and Action remain stable boundaries. Change foundations only with measured correctness, quality, performance, security or source-contract evidence."
    },
    {
      "id": "why",
      "title": "Why it exists",
      "body": "Stable boundaries protect provenance and reduce unnecessary infrastructure."
    },
    {
      "id": "related",
      "title": "Related concepts",
      "body": "Learn these connected concepts next."
    },
    {
      "id": "technical",
      "title": "Technical detail",
      "body": "The accepted ADR is the authority. Where it gives no further rationale, this page makes no additional claim."
    },
    {
      "id": "implementation",
      "title": "Implementation",
      "body": "Open the checked implementation, tests, contracts and migrations below. These links identify evidence, not new verification."
    }
  ],
  "steps": [],
  "reviewedPeerDigest": "6c9ad507e9375cdaa5f0d444497a51f765f5da2210886d479b5b7f38e00fe3c2"
}
