{
  "id": "sqlite",
  "title": "SQLite 운영 저장소",
  "sections": [
    {
      "id": "one-sentence",
      "title": "한 줄 설명",
      "body": "정식 지식 대신 운영 기록을 보관하는 로컬 저장소입니다."
    },
    {
      "id": "plain-language",
      "title": "쉽게 설명하면",
      "body": "정식 지식 대신 운영 기록을 보관하는 로컬 저장소입니다. 전체 문서 여정의 한 부분으로 이해하면 됩니다."
    },
    {
      "id": "example",
      "title": "실제 예시",
      "body": "검색 추적과 피드백 기록은 의미 그래프와 별도로 보관합니다."
    },
    {
      "id": "in-knowledge-os",
      "title": "Knowledge OS에서는",
      "body": "ADR에 따라 SQLite가 로컬 감사·관측·오류·피드백·평가를 담당합니다."
    },
    {
      "id": "why",
      "title": "왜 필요한가",
      "body": "별도 지식 데이터베이스를 만들지 않고 운영 기록을 분리하기 위해서입니다."
    },
    {
      "id": "related",
      "title": "다른 개념과의 관계",
      "body": "다음 개념을 함께 읽으면 이해가 이어집니다."
    },
    {
      "id": "technical",
      "title": "기술적으로는",
      "body": "아래의 정확한 저장소 참조를 따라 확인할 수 있습니다. 참조가 존재한다고 새로운 실행 검증 결과가 되는 것은 아닙니다."
    },
    {
      "id": "implementation",
      "title": "실제 구현 위치",
      "body": "아래에서 확인된 구현·테스트·계약·마이그레이션을 열 수 있습니다. 링크는 근거 위치를 가리키며 새로운 검증을 뜻하지 않습니다."
    }
  ],
  "steps": [],
  "reviewedPeerDigest": "fd356933bb8cb346c7ed516f27eafff67327d8422ec530eb195926c60a1cba7e"
}
