{
  "id": "recovery",
  "title": "백업과 복구 (Backup / Recovery)",
  "sections": [
    {
      "id": "one-sentence",
      "title": "한 줄 설명",
      "body": "시스템 복원에 필요한 산출물을 보존하고 검사하는 과정입니다."
    },
    {
      "id": "plain-language",
      "title": "쉽게 설명하면",
      "body": "시스템 복원에 필요한 산출물을 보존하고 검사하는 과정입니다. 전체 문서 여정의 한 부분으로 이해하면 됩니다."
    },
    {
      "id": "example",
      "title": "실제 예시",
      "body": "복구 세트에 Neo4j·SQLite 백업과 체크섬을 담습니다."
    },
    {
      "id": "in-knowledge-os",
      "title": "Knowledge OS에서는",
      "body": "복구는 제한된 캡처 시간 구간을 기록하고 산출물을 검사합니다. 저장소 간 분산 트랜잭션은 아닙니다."
    },
    {
      "id": "why",
      "title": "왜 필요한가",
      "body": "백업 파일은 무결성과 복원 한계를 알아야 유용합니다."
    },
    {
      "id": "related",
      "title": "다른 개념과의 관계",
      "body": "다음 개념을 함께 읽으면 이해가 이어집니다."
    },
    {
      "id": "technical",
      "title": "기술적으로는",
      "body": "아래의 정확한 저장소 참조를 따라 확인할 수 있습니다. 참조가 존재한다고 새로운 실행 검증 결과가 되는 것은 아닙니다."
    },
    {
      "id": "implementation",
      "title": "실제 구현 위치",
      "body": "아래에서 확인된 구현·테스트·계약·마이그레이션을 열 수 있습니다. 링크는 근거 위치를 가리키며 새로운 검증을 뜻하지 않습니다."
    }
  ],
  "steps": [],
  "reviewedPeerDigest": "a8031cb8e3cd0d99780526a190ee6947344d2e0fe5257c542da3351a2ca305bf"
}
