{
  "id": "claim",
  "title": "주장 (Claim)",
  "sections": [
    {
      "id": "one-sentence",
      "title": "한 줄 설명",
      "body": "사실이라고 제시된 내용으로, 이를 뒷받침할 근거가 필요한 주장입니다."
    },
    {
      "id": "plain-language",
      "title": "쉽게 설명하면",
      "body": "“우리 도구가 더 빠르다”는 주장이고, 측정한 비교 결과는 근거가 될 수 있습니다."
    },
    {
      "id": "example",
      "title": "실제 예시",
      "body": "모델이 Joule Studio가 특정 생태계에 속한다고 제안해도 검토자는 원문을 확인해야 합니다."
    },
    {
      "id": "in-knowledge-os",
      "title": "Knowledge OS에서는",
      "body": "여기서 Claim은 설명용 용어이며 별도의 정식 데이터 객체를 추가하지 않습니다. 진술 후보는 기존 Proposal/Assertion 경로를 사용합니다."
    },
    {
      "id": "why",
      "title": "왜 필요한가",
      "body": "후보 진술과 받아들인 지식을 구별하기 위한 용어입니다."
    },
    {
      "id": "related",
      "title": "다른 개념과의 관계",
      "body": "다음 개념을 함께 읽으면 이해가 이어집니다."
    },
    {
      "id": "technical",
      "title": "기술적으로는",
      "body": "F1 같은 검증 주장은 구현의 정확성에 관한 것이며 업무 도메인의 진술과는 다릅니다."
    },
    {
      "id": "implementation",
      "title": "실제 구현 위치",
      "body": "아래에서 확인된 구현·테스트·계약·마이그레이션을 열 수 있습니다. 링크는 근거 위치를 가리키며 새로운 검증을 뜻하지 않습니다."
    }
  ],
  "steps": [],
  "reviewedPeerDigest": "1b6f75f99218943c14531c05df91685632958a6aa58157910287f9e4f0cbb732"
}
