{
  "id": "system-of-context",
  "title": "맥락 시스템 (System of Context)",
  "sections": [
    {
      "id": "one-sentence",
      "title": "한 줄 설명",
      "body": "원본의 주인을 바꾸지 않고 기록을 이해할 수 있도록 연결한 관점입니다."
    },
    {
      "id": "plain-language",
      "title": "쉽게 설명하면",
      "body": "메모 하나만 보면 뜻이 모호할 수 있습니다. 프로젝트, 결정, 근거와 연결하면 맥락이 드러납니다."
    },
    {
      "id": "example",
      "title": "실제 예시",
      "body": "어떤 결정을 뒷받침했던 문서 버전을 함께 보면 그 결정의 배경을 이해할 수 있습니다."
    },
    {
      "id": "in-knowledge-os",
      "title": "Knowledge OS에서는",
      "body": "안정 계약 아래에서 의미 있는 기록, 근거, 결정 이력을 그래프에 유지합니다."
    },
    {
      "id": "why",
      "title": "왜 필요한가",
      "body": "에이전트에게는 흩어진 파일 복사본보다 설명 가능한 맥락이 필요합니다."
    },
    {
      "id": "related",
      "title": "다른 개념과의 관계",
      "body": "다음 개념을 함께 읽으면 이해가 이어집니다."
    },
    {
      "id": "technical",
      "title": "기술적으로는",
      "body": "승인된 ADR은 의미 맥락을 Neo4j에, 운영 기록을 SQLite에 배치합니다."
    },
    {
      "id": "implementation",
      "title": "실제 구현 위치",
      "body": "아래에서 확인된 구현·테스트·계약·마이그레이션을 열 수 있습니다. 링크는 근거 위치를 가리키며 새로운 검증을 뜻하지 않습니다."
    }
  ],
  "steps": [],
  "reviewedPeerDigest": "e598f746d2babb66a6a14ce8d4cd9affab37c1cf0f883784e3395297faa02f84"
}
